<?xml version="1.0" encoding="UTF-8"?>
<tns:SensorConfiguration xmlns:tns="http://www.teco.edu/SSimp" xmlns:xsi="http://www.w3.org/2001/XMLSchema-instance" xsi:schemaLocation="http://www.teco.edu/SSimp config.xsd ">
  <tns:sensors>
    <tns:AcclX/>
    <tns:AcclY/>
    <tns:AcclZ/>
    <tns:Audio/>
    <tns:Light/>
    <tns:Force/>
    <tns:Voltage/>
  </tns:sensors>
</tns:SensorConfiguration>